"Authors","Author full names","Author(s) ID","Title","Year","Source title","Volume","Issue","Art. No.","Page start","Page end","Cited by","DOI","Link","Abstract","Author Keywords","Index Keywords","Document Type","Publication Stage","Open Access","Source","EID"
"Teimoori Z.; Yassine A.; Shamim Hossain M.","Teimoori, Zeinab (57455303400); Yassine, Abdulsalam (24722051600); Shamim Hossain, M. (57219458636)","57455303400; 24722051600; 57219458636","A Secure Cloudlet-Based Charging Station Recommendation for Electric Vehicles Empowered by Federated Learning","2022","IEEE Transactions on Industrial Informatics","18","9","","6464","6473","71","10.1109/TII.2022.3148997","https://www.scopus.com/pages/publications/85124733711?origin=resultslist","The fast-growing electric vehicles (EVs) industry requires a well-designed recommendation system to locate charging stations while ensuring private data protection. This article proposes a secure cloudlet-based recommendation system for EVs. Unlike conventional methods where training a recommender model involves direct data sharing between data holders, our model utilizes a secure vertical federated learning technique, in which EVs data do not leave the platforms. To improve the efficiency of the model and to alleviate the communication-related concerns in our recommender model, cloudlet-based data aggregator(s) are used as a replacement for the existing centralized architectures. To enhance the security of our system, blockchain technology is incorporated to generate a trusted network of cloudlets that are responsible for transmitting the locally computed training parameters. The simulation results achieved from our proposed recommendation system show that the distribution of EVs over a designated area with charging stations is more optimal, and the proposed decentralized recommender with 10 cloudlets is 5.2 s quicker than a conventional centralized model. © 2005-2012 IEEE.","Blockchain; Charging station recommendation; Cloudlet; Electric vehicles (EVs); Vertical federated learning (VFL)","Blockchain; Charging (batteries); Cloud computing; Electric vehicles; Interactive computer systems; Recommender systems; Block-chain; Charging station; Charging station recommendation; Cloud-computing; Cloudlet; Collaborative Work; Real - Time system; Vertical federated learning; Real time systems","Article","Final","","Scopus","2-s2.0-85124733711"
"Wang B.; Yang Y.; Liu W.; Xu L.","Wang, Beibei (55729730100); Yang, Yikun (59916551700); Liu, Wenjie (58600564400); Xu, Lun (57211231795)","55729730100; 59916551700; 58600564400; 57211231795","A Privacy-Preserving Scheme for Charging Reservations and Subsequent Deviation Settlements for Electric Vehicles Based on a Consortium Blockchain","2025","World Electric Vehicle Journal","16","5","243","","","2","10.3390/wevj16050243","https://www.scopus.com/pages/publications/105006636998?origin=resultslist","Electric vehicles have garnered substantial attention as an environmentally sustainable transportation alternative amid escalating global concerns regarding ecological preservation and energy resource management. While the proliferation of electric vehicles necessitates the development of efficient and secure charging infrastructure, the inherent communication-intensive nature of the charging processes has raised concerns regarding potential privacy vulnerabilities. Our paper introduces a privacy protection scheme specifically designed for electric vehicle charging reservations to address this issue. The primary goal of this scheme is to protect user privacy while maintaining operational efficiency and economic viability for charging providers. Our proposed solution ensures a secure and private environment for charging reservation transactions and subsequent deviation settlements by incorporating advanced technologies, including zero-knowledge proof, a consortium blockchain, and homomorphic encryption. The scheme encrypts charging reservation information and securely transmits it via a consortium blockchain, effectively shielding the sensitive data of all participating parties. Notably, the experimental findings establish the robustness of our scheme in terms of its security and privacy protection, aligning with the stringent demands of electric vehicle charging operations. © 2025 by the authors.","consortium blockchain; electric vehicle; homomorphic encryption; Pedersen commitment; privacy preserving; zero-knowledge proof","Anonymity; Differential privacy; Electric vehicles; Privacy by design; Resource allocation; Block-chain; Consortium blockchain; Ecological preservation; Electric vehicle charging; Ho-momorphic encryptions; Homomorphic-encryptions; Pedersen commitment; Privacy preserving; Sustainable transportation; Zero-knowledge proofs; Sensitive data","Article","Final","All Open Access; Gold Open Access; Green Open Access","Scopus","2-s2.0-105006636998"
"Hu X.; Jiang X.; Zhang J.; Wang S.; Zhou M.; Zhang B.; Gan Z.; Yu B.","Hu, Xin (59518646600); Jiang, XiaoNing (8865540600); Zhang, Jie (59518646700); Wang, ShouGuang (55979076600); Zhou, MengChu (7403506743); Zhang, Bei (59844104700); Gan, ZhiGang (57224606206); Yu, BinXiao (7402092726)","59518646600; 8865540600; 59518646700; 55979076600; 7403506743; 59844104700; 57224606206; 7402092726","Electric vehicle charging network security: A survey","2025","Journal of Systems Architecture","159","","103337","","","10","10.1016/j.sysarc.2025.103337","https://www.scopus.com/pages/publications/85215426056?origin=resultslist","With the rising number of electric vehicles, their charging network has expanded into a vast and intricate system involving multiple stakeholders and numerous charging service entities. It relies on various technologies, such as communication protocols, network connections, and data transmission, leading to the generation of substantial amounts of sensitive data. Ensuring its high security requires the implementation of a comprehensive array of security measures, including stringent identity authentication and access control techniques, cryptographic solutions to safeguard data, and diverse strategies for detecting and countering network attacks. In this article, we present a comprehensive overview of the mainstream architectures and communication protocols in electric vehicle charging networks. We also provide a brief introduction to other protocols used in charging networks and explore the charging infrastructure and its associated security requirements. We examine a charging network's security challenges at its perception, network, and application layers, and summarize the important solutions proposed in recent literature. Additionally, we delve into privacy security and payment security in the charging business. We investigate the utilization of blockchain technology to safeguard charging networks. Finally, we highlight public safety issues of a charging network and suggest future research directions to steer further studies of charging network security. © 2025 Elsevier B.V.","Blockchain; Charging network; Electric vehicle; Internet of Things; Payment; Privacy; Security","Block-chain; Charging network; Communications protocols; Electric vehicle charging; Intricate systems; Multiple stakeholders; Networks security; Payment; Privacy; Security; Charging stations","Review","Final","","Scopus","2-s2.0-85215426056"
"Deshmukh N.; Khairnar V.; Vora D.; Jovanovic A.; Mouël F.L.","Deshmukh, Neha (57193561842); Khairnar, Vaishali (48761682200); Vora, Deepali (57656448500); Jovanovic, Aleksandar (57695257900); Mouël, Frédéric Le (15136452200)","57193561842; 48761682200; 57656448500; 57695257900; 15136452200","EVMCSDLT: Electric vehicle mobile charging system using distributed ledger technology","2025","MethodsX","15","","103553","","","0","10.1016/j.mex.2025.103553","https://www.scopus.com/pages/publications/105012584054?origin=resultslist","The accelerating adoption of electric vehicles (EVs) has revealed a significant challenge: ensuring accessible, secure charging infrastructure in areas with limited internet connectivity. This study introduces EVMCSDLT, a novel payment framework that leverages Distributed Ledger Technology (DLT) to facilitate secure transactions between EV users and mobile charging stations in offline environments. Unlike conventional payment systems that require continuous Internet connectivity, EVMCSDLT employs a two-part blockchain security mechanism using QR code authentication and hashing techniques. This mechanism distributes security data across both the sender's & receiver's devices, enabling transactions to be validated & recorded locally before subsequent synchronization with the blockchain network. The system is implemented using React.js integrated with Web3, supporting both online & offline transaction processing via MetaMask wallet. It also features real time geospatial tracking of fixed and mobile charging stations through Google Maps, allowing users to locate nearby charging options efficiently. Experimental results demonstrate a reliable transaction range of up to 8.13 meters between devices, consistent QR code scanning with an average response time of 3.4 s under various lighting conditions, and strong resistance to cyber threats in simulated man-in-the-middle attacks. The EVMCSDLT framework marks a significant advancement in extending the accessibility of EV charging technology to underserved areas while ensuring transaction security and integrity regardless of the Internet connectivity status. © 2025 The Authors","Blockchain; Distributed ledger technology; Electric vehicles; Mobile charging; Offline payments; Security","blockchain; controlled study; diagnosis; human; illumination; Internet; man in the middle attack; QR-code; reaction time; review; simulation","Review","Final","All Open Access; Gold Open Access; Green Open Access","Scopus","2-s2.0-105012584054"
"Moniruzzaman M.; Yassine A.; Hossain M.S.","Moniruzzaman, Md (59622742700); Yassine, Abdulsalam (24722051600); Hossain, M. Shamim (24066717900)","59622742700; 24722051600; 24066717900","Energizing Charging Services for Next-Generation Consumers E-Mobility With Reinforcement Learning and Blockchain","2024","IEEE Transactions on Consumer Electronics","70","1","","2269","2280","12","10.1109/TCE.2023.3345015","https://www.scopus.com/pages/publications/85182377347?origin=resultslist","Next-generation consumer electronics and electric vehicle (EV) energy charging technology promise transformative advancements in the automotive industry. One of the main challenges that hinders consumers' experience is range anxiety particularly relevant in locales where the installation of fixed charging stations (FCSs) is beset by logistical hurdles, notably in rural regions. With the advancement of consumer electronics especially in the design of Mobile Charging Stations (MCSs), EV drivers can now access these MCSs to exchange energy. However, concerns regarding data security and the best strategies to select an MCS to trade energy may negatively impact consumer experiences. This paper delves into the conception of intelligent remedies by proposing the integration of reinforcement learning and blockchain technology to empower EV drivers to access and securely exchange energy with MCSs. We design a Proof of MCSs (PoMCS) as a consensus protocol to select the winning MCSs as block miners in the blockchain. The results of our experiment show that the average gain for the MCSs increases when using the proposed model and therefore inclined to serve more EVs.  © 2023 IEEE.","blockchain; consensus protocols; electric vehicle (EV); mobile charging stations; Next-gen consumer electronics; reinforcement learning","Automotive industry; Blockchain; Charging (batteries); E-learning; Electric vehicles; Engineering education; Next generation networks; Anxiety disorder; Block-chain; Charging station; Consensus protocols; Electric vehicle; Mobile charging; Mobile charging station; Next generation networking; Next-gen consumer electronic; Reinforcement learnings; Security; Reinforcement learning","Article","Final","","Scopus","2-s2.0-85182377347"
"Sharma D.D.; Singh S.N.; Lin J.","Sharma, Desh Deepak (56924331800); Singh, S.N. (55740373500); Lin, Jeremy (56472965000)","56924331800; 55740373500; 56472965000","Blockchain-enabled secure and authentic Nash equilibrium strategies for heterogeneous networked hub of electric vehicle charging stations","2024","Blockchain: Research and Applications","5","4","100223","","","12","10.1016/j.bcra.2024.100223","https://www.scopus.com/pages/publications/85210375150?origin=resultslist","In the networked enlarged electric vehicle (EV) charging infrastructures, the security and authenticity of the stakeholders involved in the EV energy market pool are prime important. This paper proposes an EV network hub (EVNH) comprising EVs, EV aggregators (EVAs), and charging nodes in the networked EV energy market pool. The various EVAs implement different heterogeneous blockchains. The EVNH facilitates blockchain-based secure and resilient energy trading under grid to vehicle and vehicle to grid systems. The paper emphasizes interoperability challenges involving different blockchains to communicate and transfer assets or data between them. We suggest secure and trustworthy energy trading across various EVAs using multiple EV tokens for EV energy trading through cross-chain communications. The EVAs consider a Nash equilibrium-seeking strategy to find the Nash equilibrium in the noncooperative game of EVAs. The effectiveness of the proposed EVNH is tested using MATLAB, Solidity, and Python software. © 2024 The Author(s)","EV token; Heterogeneous blockchains; Interoperability; Nash equilibrium; Network hub","Vehicle-to-grid; Block-chain; Electric vehicle charging; Electric vehicle token; Energy markets; Energy trading; Heterogeneous blockchain; Nash equilibria; Nash equilibrium strategies; Network hubs; Vehicle energy; Charging stations","Article","Final","All Open Access; Gold Open Access; Green Open Access","Scopus","2-s2.0-85210375150"
"Kakkar R.; Agrawal S.; Tanwar S.","Kakkar, Riya (57362359600); Agrawal, Smita (57210236140); Tanwar, Sudeep (56576145100)","57362359600; 57210236140; 56576145100","A systematic survey on demand response management schemes for electric vehicles","2024","Renewable and Sustainable Energy Reviews","203","","114748","","","48","10.1016/j.rser.2024.114748","https://www.scopus.com/pages/publications/85199509122?origin=resultslist","The unprecedented proliferation of electric vehicles is envisioned to revolutionize the Intelligent Transportation System as an energy-efficient and environment-friendly alternative to fossil-fuel vehicles. Despite the indispensable benefits of electric vehicles, the enormous and fluctuating energy demand for electric vehicles can imperil the efficiency and stability of the electric grid, which further necessitates the discussion on balancing the demand and supply for electric vehicle efficient charging at the charging station. Some of the research studies focus on the electric vehicle demand response management but without considering various critical aspects such as security, optimality, and fluctuating parameters (electric load or traffic condition) that impact the net-zero emission or carbon neutrality that is required to fulfil some of the United Nation Sustainable Development Goals. Thus, this research study presented an exhaustive meta-survey to secure electric vehicles’ demand response management towards a smart grid environment. Consequently, the research in the meta-survey discussed the taxonomy of demand response for electric vehicles, considering various aspects such as electric vehicle modelling, load forecasting, and optimization techniques. Furthermore, this review studied the holistic discussion on various security techniques such as encryption, authentication, and consensus protocols for protected and preserved electric vehicle demand response management through the smart grid environment. Moreover, a case study is presented that focuses on the security and optimality aspects of demand response management for electric vehicles using blockchain and the reinforcement learning approach. The proposed case study focuses on optimizing electric vehicle energy trading based on optimized energy consumption for secure and efficient demand response management with the smart grid. Finally, the meta-surveys research challenges and future opportunities have been targeted and discussed for secure and optimal electric vehicle demand response management for future works. © 2024 Elsevier Ltd","Blockchain; Demand response management; Electric vehicle; Load forecasting; Optimization techniques; Reinforcement learning; Smart grid","Authentication; Electric loads; Energy efficiency; Energy utilization; Environmental management; Fossil fuels; Intelligent systems; Reinforcement learning; Smart power grids; Sustainable development; Block-chain; Demand response; Demand response management; Load forecasting; Optimality; Optimization techniques; Reinforcement learnings; Research studies; Response management; Smart grid; Blockchain","Review","Final","","Scopus","2-s2.0-85199509122"
"Rajaram A.; Almalki F.A.","Rajaram, A. (36633060200); Almalki, Faris A. (57189048802)","36633060200; 57189048802","Energy efficient decentralized digital twins with IoT and blockchain for self-optimizing urban infrastructure and sustainable energy management","2026","Sustainable Computing: Informatics and Systems","50","","101319","","","0","10.1016/j.suscom.2026.101319","https://www.scopus.com/pages/publications/105030491987?origin=resultslist","Digital twins have become formidable systems of real-time control and optimization of urban infrastructures, but the conventional centralized versions are subject to critical bottlenecks of data, overheads of power consumption, and susceptibility to cyber-physical attacks. The proposed framework in this paper is Energy-Efficient Decentralized Digital Twin (E2-DTwin) which incorporates IoT-based sensing, blockchain-based data reconciliation, and Graph Neural Network (GNN)-based spatiotemporal modeling to support self-optimizing city energy management. The E2-DTwin contrasts traditional centralized technologies and implements intelligence sharing among networked farms of photovoltaic microgrids and EV chargers and water-energy nexus without interventions on the blockchain through which the decentralized twin versions are synchronized. The GNN module learns how the assets of the city have interdependence with each other to anticipate anomalies and preemptively control operations. Simulation of the proposed system on the Hyperledger Besu and MATLAB Simscape platform shows that the system is associated with higher accuracy in anomaly detection (31.5 %) and faster decision magnification (26.8 %) and reduced overhead on its synchronization (18.9 %) than the centralized baselines. Such results underscore the novelty of the framework to combine decentralized trust, predictive intelligence, and energy efficiency and lead to cyber-resilient, sustainable, and autonomous infrastructures of smart cities. © 2026","Blockchain; Digital twin; Graph neural networks; IoT; Smart infrastructure; Sustainable energy","Anomaly detection; Digital twin; Energy efficiency; Energy management; Energy management systems; MATLAB; Microgrids; Real time systems; Smart city; Time sharing systems; Block-chain; Centralised; Decentralised; Energy efficient; Graph neural networks; IoT; Self-optimizing; Smart infrastructures; Sustainable energy; Urban infrastructure; Blockchain","Article","Final","","Scopus","2-s2.0-105030491987"
"Almalki A.J.","Almalki, Ali Jaber (59025994800)","59025994800","Smart Energy Transactions in Vehicle-to-Grid Networks: A Deep Q-Network Approach with Blockchain","2025","Fusion: Practice and Applications","17","2","","294","314","0","10.54216/FPA.170222","https://www.scopus.com/pages/publications/85211218703?origin=resultslist","Electric vehicles (EVs) have gained significant traction due to their environmental benefits and potential to revolutionize the transportation sector. Integrating EVs into the Vehicle-to-Grid (V2G) network presents an innovative solution for optimizing energy transactions and grid stability. However, managing energy transactions during peak hours poses a challenge. This research proposes a novel approach that combines the Deep Q-Network (DQN) algorithm with block chain technology to enhance energy transactions in the V2G network. In this study, a V2G network model is introduced consisting of EVs, charging stations, a grid control center, and a block chain infrastructure. The block chain ensures transparency, security, and decentralized energy transactions. The DQN algorithm learns optimal action policies based on current states and rewards, contributing to grid stability. To incentivize EV owners for peak-hour energy contributions, a block chain-enabled rewarding mechanism is implemented. The proposed methodology is rigorously evaluated through simulations conducted in a custom environment that emulates V2G network dynamics. Performance metrics such as load shifting efficiency, peak demand reduction, and energy efficiency are employed for comprehensive assessment. The proposed method showcases superior performance compared to traditional load shifting and demand response strategies. Furthermore, comparative analyses are conducted against different state-of-the-art methods, demonstrating the effectiveness of our approach. The results underscore the potential of integrating DQN-based energy management with block chain technology to achieve grid stability and incentivize sustainable energy behaviors. This research contributes to the advancement of smart grid technologies, paving the way for a more sustainable and efficient energy ecosystem. © 2025, American Scientific Publishing Group (ASPG). All rights reserved.","Accumulative reward; Action policy; Block chain; Deep Q-network; Electric vehicle; Energy transaction; Grid control center and charging station; Vehicle-to-grid","","Article","Final","","Scopus","2-s2.0-85211218703"
"Naik M.; Singh A.P.; Pradhan N.R.; Almuhaideb A.M.; Kumar N.","Naik, Madhusudan (58547855800); Singh, Akhilendra Pratap (58819144100); Pradhan, Nihar Ranjan (57219549234); Almuhaideb, Abdullah Mohammed (36160102700); Kumar, Neeraj (57206866080)","58547855800; 58819144100; 57219549234; 36160102700; 57206866080","A Framework for Blockchain-Enabled Internet of Electric Vehicles Charging Station Sustainability Performance Evaluation","2025","IEEE Internet of Things Journal","12","5","","4726","4737","6","10.1109/JIOT.2024.3504394","https://www.scopus.com/pages/publications/85210270952?origin=resultslist","Electric vehicle (EV) charging stations (CSs) are increasingly prevalent due to the growing adoption of renewable energy. Solar CSs' main difficulties are energy efficiency, security, traceability, and sustainability. This article presents a novel blockchain-enabled EV charging framework that addresses these challenges using the Ethereum virtual machine (EVM), the Metamask wallet, and smart contracts (SCs). This article introduces solarcoins, a digital currency for trading solar energy, which reduces human intervention while fostering trust, transparency, and privacy among EV users. The proposed solution ensures secure communication between CS operators and EV users, enhancing both security and traceability. The proposed solution ensures secure communication between CS operators and EV users, enhancing both security and traceability. To quantify the sustainability and efficiency of the proposed system, the framework performances are tested and evaluated by varying numbers and types (Read, Write, and Transfer) of transactions using Hyperledger caliper and Go Ethereum. The overhaul Performance metrics were measured under varied transaction rates and control parameters by varying the number of validator nodes (1 node to 5 nodes), such as transaction latency, throughput, resource utilization, and so on. The performance of three major functions - open, query, and transfer - was recorded and analyzed. The results show that the query transaction is faster than open and transfer and the latency increases linearly with increased transaction rate. At 1000 transaction per second, the open function has a latency of 260.22 s, whereas the query function has a latency of 104.12 s and the transfer function has a latency of 345.73 s. The average memory usage for 1node-clique is 1224.0 MB, while it is 76.8 MB for 5node-clique. Results reveal that with an increase in the number of cliques (Validator CSs), memory utilization decreased linearly. This happens because all framework transactions are distributed across each EV CS network. The SCs deployment and operational costs were measured. Complexity analysis reveals that functions, such as getStation, getUser, getStationState, etc., exhibit constant time complexity O(1), while the registerUser and addStation functions have linear space and time complexity O(n).  © 2014 IEEE.","Blockchain; caliper; electric vehicles (EVs); Ethereum; peer-to-peer energy trading (P2PET); solar charging","Analog storage; Blockchain; Charging stations; Computer graphics equipment; Lyapunov methods; Medium access control; Secure communication; Technical writing; Virtual addresses; Block-chain; Caliper; Charging station; Electric vehicle charging; Energy; Energy trading; Peer to peer; Peer-to-peer energy trading; Solar charging; Vehicle users; Ethereum","Article","Final","","Scopus","2-s2.0-85210270952"
