"Authors","Author full names","Author(s) ID","Title","Year","Source title","Volume","Issue","Art. No.","Page start","Page end","Cited by","DOI","Link","Abstract","Author Keywords","Index Keywords","Document Type","Publication Stage","Open Access","Source","EID"
"Bhattacharya P.; Tanwar S.; Bodkhe U.; Kumar A.; Kumar N.","Bhattacharya, Pronaya (57200306370); Tanwar, Sudeep (56576145100); Bodkhe, Umesh (57211485844); Kumar, Ashwani (57209569726); Kumar, Neeraj (57206866080)","57200306370; 56576145100; 57211485844; 57209569726; 57206866080","EVBlocks: A Blockchain-Based Secure Energy Trading Scheme for Electric Vehicles underlying 5G-V2X Ecosystems","2022","Wireless Personal Communications","127","3","","1943","1983","19","10.1007/s11277-021-08732-5","https://www.scopus.com/pages/publications/85110671778?origin=resultslist","In this paper, the authors propose a secure and trusted energy trading (ET) scheme for electric vehicles (EVs) for vehicle-to-anything (V2X) ecosystems. The scheme, named as EVBlocks, facilitates ET among entities (i.e., EVs, charging stations (CS), and smart grids (SG)) in a secured and trusted manner through a consortium blockchain (CBC) network. The scheme operates in three phases. In the first phase, to allow real-time and resilient network orchestration of V2X nodes, we consider the ET service designed over a fifth-generation (5G) enabled software-defined networking (SDN) environment. Integration of SDN in 5G-V2X ecosystems allows V2X nodes to eliminate intermediaries and handle many requests with a minimum response time. Then, in the second phase, a non-cooperative game is presented that optimizes a cost function and converges to reach at least one Nash equilibrium point. Finally, a consensus algorithm Proof-of-Greed (PoG) is proposed that handles fluctuations in charging/discharging EVs through an event-driven scheduling mechanism. The obtained results are compared against parameters, such as ET time, State-of-Charge (SoC) levels, EV utility, block-convergence time, profits, computation, and communication costs. For example, EVBlocks achieve an average SOC charge of 22.8MW, with a peak at 377.5MW, the average power dissipation of 4.1125 kWH that is lower than 25 % against existing conventional and fixed tariff schemes. The scheme converges at stable profit values for 5 EVs through a non-cooperative game. For proposed PoG consensus, the block convergence time for 1000 nodes is 138.96 seconds, at a computation cost of 46.92 milliseconds (ms) and communication cost of 149 bytes. The comparative analysis suggests the proposed scheme is efficient as compared to existing state-of-the-art approaches against compared parameters. © 2021, The Author(s), under exclusive licence to Springer Science+Business Media, LLC, part of Springer Nature.","5G; Blockchain; Cellular vehicle-to-anything; Distributed consensus; Electric vehicles; Energy trading; Non-cooperative game","5G mobile communication systems; Blockchain; Charging (batteries); Cost functions; Electric vehicles; Game theory; Power markets; Vehicle to Everything; 5g; Block-chain; Cellular vehicle-to-anything; Cellulars; Computation costs; Convergence time; Distributed consensus; Energy trading; Noncooperative game; Software-defined networkings; Profitability","Article","Final","","Scopus","2-s2.0-85110671778"
"Khalid R.; Malik M.W.; Alghamdi T.A.; Javaid N.","Khalid, Rabiya (57194326674); Malik, Muhammad Waseem (57216509312); Alghamdi, Turki Ali (35758232500); Javaid, Nadeem (26428797500)","57194326674; 57216509312; 35758232500; 26428797500","A consortium blockchain based energy trading scheme for Electric Vehicles in smart cities","2021","Journal of Information Security and Applications","63","","102998","","","39","10.1016/j.jisa.2021.102998","https://www.scopus.com/pages/publications/85117705858?origin=resultslist","The real time Vehicle-to-Grid (V2G) and Vehicle-to-Vehicle (V2V) energy trading have ameliorated the smart city environment. Electric Vehicles (EVs) in smart cities have made it possible to balance the energy demand and supply without burdening the power grids. They also help in minimizing both the heap amounts of pollution and the greenhouse gas emissions. EVs not only charge their batteries from Charging Stations (CSs), but when the smart city faces energy deficiency, they supply their surplus energy to the power grids to fulfill energy demand as well. In addition, EVs also balance the energy demand and supply through energy trading at the local level during peak hours, which strengthens V2V energy trading. However, some issues, such as security threats and privacy leakage prevent EVs from participating in the energy trading process. In addition, the lack of incentives and knowledge about the cost of reaching the energy trading place within minimum time are also big challenges. Therefore, to solve the aforementioned challenges, a secure and efficient scheme for V2V and V2G energy trading is proposed in this paper. The proposed scheme also helps in promoting environmental friendliness and making the smart cities sustainable and reliable. In the proposed scheme, energy trading transactions are secured using consortium blockchain, wherein the Local Aggregators (LAGs) are selected as authorized nodes. LAGs perform their role as energy brokers and are responsible for validating the energy trading requests using Proof of Authority (PoA) consensus mechanism. Moreover, a solution to find accurate distance with required expenses and time to reach the charging destination is also proposed, which effectively guides EVs to reach the relevant CSs and encourages energy trading. Besides, we propose a fair payment mechanism using a smart contract to avoid financial irregularities. An incentive provisioning mechanism is also given in the proposed work to prevent EVs from acting selfishly. The efficient power flow having minimized losses in the vehicular network is of much importance. Therefore, the energy losses incurred in both V2G and V2V are discussed in this work. Furthermore, Oyente is used for smart contract's security analysis and for testing Ethereum's resilience against different security flaws. Two attacker models are proposed and the security analyses of the models are also provided. The analyses show that the proposed system is robust against the double spending and Sybil attacks. Finally, the efficient performance of our proposed scheme is validated and analyzed. The simulation results proved that our proposed work outperforms existing work in terms of providing a secure and efficient energy trading platform for both V2G and V2V environments. © 2021 Elsevier Ltd","Consortium blockchain; Electric Vehicles; Energy trading; Smart cities; Smart contract","Blockchain; Charging (batteries); Electric load flow; Electric power transmission networks; Electric vehicles; Energy dissipation; Energy management; Gas emissions; Greenhouse gases; Network security; Power markets; Security systems; Smart city; Vehicle-to-grid; Block-chain; Charging station; Consortium blockchain; Demand and supply; Energy demands; Energy supplies; Energy trading; Real- time; Security analysis; Vehicle to Grid (V2G); Smart contract","Article","Final","","Scopus","2-s2.0-85117705858"
"Tanwar S.; Kakkar R.; Gupta R.; Raboaca M.S.; Sharma R.; Alqahtani F.; Tolba A.","Tanwar, Sudeep (56576145100); Kakkar, Riya (57362359600); Gupta, Rajesh (57201584761); Raboaca, Maria Simona (57205523105); Sharma, Ravi (59867627700); Alqahtani, Fayez (56113467000); Tolba, Amr (56442428300)","56576145100; 57362359600; 57201584761; 57205523105; 59867627700; 56113467000; 56442428300","Blockchain-based electric vehicle charging reservation scheme for optimum pricing","2022","International Journal of Energy Research","46","11","","14994","15007","25","10.1002/er.8199","https://www.scopus.com/pages/publications/85131210361?origin=resultslist","The adaptation of intelligent transportation system has evolved the quality of life of people with the huge demand for electric vehicles. Moreover, it becomes essential to schedule an electric vehicle for charging optimally. Therefore, this paper proposes a blockchain-based electric vehicle charging reservation scheme for optimum pricing. It primarily aims to secure data transactions between electric vehicles and charging stations. It uses the communication channel as 5G to ensure ultra-low latency and extremely high reliability. Furthermore, the proposed scheme uses a double-auction mechanism to optimize the payoff for both electric vehicles and charging stations. The performance of the proposed scheme is evaluated by distinguishing it from the conventional networks such as 4G and LTE-A. The performance parameters are considered profit and loss for electric vehicles, scalability, cost overhead for data storage, communication overhead for data transactions, and data storage cost. Results show that the proposed scheme is secure and achieves the optimized payoff for electric vehicles and charging stations compared with traditional approaches. © 2022 John Wiley & Sons Ltd.","blockchain; double-auction mechanism; electric vehicle charging; ethereum; optimum pricing; smart contract","Charging (batteries); Costs; Digital storage; Electric losses; Electric vehicles; Ethereum; Intelligent systems; Block-chain; Charging station; Data storage; Data transaction; Double auction mechanism; Electric vehicle charging; Intelligent transportation systems; Optimum pricing; Quality of life; Secure data; Smart contract","Article","Final","","Scopus","2-s2.0-85131210361"
"Peelam M.S.; Chamola V.","Peelam, Mritunjay Shall (57263897400); Chamola, Vinay (55427784900)","57263897400; 55427784900","Blockchain-Enabled Secure V2V and V2G Energy Trading for Carbon-Aware Internet of Energy (IoE) Networks","2026","IEEE Network","40","2","","97","103","1","10.1109/MNET.2025.3619992","https://www.scopus.com/pages/publications/105020985565?origin=resultslist","As the Internet of Energy (IoE) network expands, integrating Electric Vehicles (EVs) into de-centralized energy systems is essential for a secure and sustainable low-carbon future. However, EV adoption faces challenges such as limited driving range and inadequate charging infrastructure, particularly in rural and highway areas. This paper presents a blockchain-enabled framework for secure Vehicle-to-Vehicle (V2V) and Vehicle-to-Grid (V2G) energy trading, enhancing energy flexibility within the Carbon-­Intelligent IoE. The framework optimizes trading strategies, ensures fairness, and stabilizes the grid by incorporating key game-theoretic models, Contract Theory, Bayesian Game Theory, and Evolutionary Game Theory, which are central to the proposed energy trading mechanism. Built on a lightweight Hyperledger Fabric architecture, the framework enables secure, transparent, and cost-efficient transactions. Performance evaluations show high efficiency, with transaction throughputs of 49.8 TPS for payments, 44.7 TPS for energy trades, and an average latency of 0.09-0.18 seconds. Resource utilization analysis indicates an average CPU usage of 23.76% and memory consumption of 169.5 MB during trade proposals. These results demonstrate the framework's scalability, security, and robustness in enabling decentralized, carbon-intelligent energy trading within the IoE, advancing next-generation smart energy ecosystems.  © 2025 IEEE.","","Bayesian networks; Blockchain; Carbon; Ecosystems; Internet of Energy; Networks (circuits); Power markets; Vehicles; Block-chain; Charging infrastructures; Decentralized energy system; Driving range; Energy; Energy networks; Energy trading; Low-carbon futures; Vehicle to Grid (V2G); Vehicle to vehicles; Game theory","Article","Final","","Scopus","2-s2.0-105020985565"
"Kavitha D.; Sharmila B.","Kavitha, D. (57209768970); Sharmila, B. (57194622852)","57209768970; 57194622852","Smart battery management in EVs using IoT, blockchain, and machine learning","2025","Scientific Reports","15","1","37650","","","0","10.1038/s41598-025-21605-2","https://www.scopus.com/pages/publications/105020175347?origin=resultslist","Electric Vehicles (EVs) have gained significant attention in recent years, mostly owing to the advancements in electric motors and minimal impact on the environment. In the same way, the rapid development of the Internet of Things (IoT) facilitated the interconnection of an increasing number of devices. A significant challenge that EVs have presently is the restricted battery range and a shortage of charging or battery switching facilities. The Battery Management System (BMS) is significant in EVs since it regulates and monitors battery functionality, providing optimal efficiency and prolonging battery lifespan. Integrating IoT and Blockchain (BC) in BMS offers a promising approach to enhance energy efficiency and battery state evaluation. In this research, a BMS model for EVs using IoT, blockchain and machine learning (ML) is developed. The IoT sensors have been equipped to the electric vehicles to gather data such as the level of charging, the distance to be travelled, and the EVs location. For determining the cost of charging, this information is stored and processed by a database, and then it is given as input to the Extreme Gradient Boosting (XGBoost) classifier. After that, the power scheduling based on the Grey Wolf Optimization (GWO) technique processes it to determine the location of the charging station, as well as the time and space of charging that is closest. Finally, this data is stored in blocks to prevent intruders from gaining access to electric vehicles and to ensure that pricing transactions between users and charging stations are carried out in a secure manner. For these secure transactions, a permissioned blockchain with homomorphic encryption (HE) is implemented. The results show that the research work produced an enhanced BMS model with an accuracy rate of 97.36% in detecting close charging station and that it maintains a communication overhead with 35 ms, which was 14% lower than the compared models. © The Author(s) 2025.","Blockchain; Electric vehicles; GWO; HE; IoT; Machine learning; XGBoost","article; blockchain; classifier; controlled study; data base; diagnosis; electric engine; homomorphic encryption; human; internet of things; machine learning; pharmaceutics; sensor","Article","Final","All Open Access; Gold Open Access; Green Open Access","Scopus","2-s2.0-105020175347"
"Zhang L.; Jiang Y.; Mu Y.; Wang S.; Li Y.","Zhang, Long (60513486400); Jiang, Yulian (55968317400); Mu, Yunfei (57204544198); Wang, Shenquan (48662854400); Li, Yang (57202365586)","60513486400; 55968317400; 57204544198; 48662854400; 57202365586","Blockchain-based fully decentralized stable federated learning charging station load forecasting method for privacy and security","2026","Sustainable Computing: Informatics and Systems","50","","101335","","","0","10.1016/j.suscom.2026.101335","https://www.scopus.com/pages/publications/105033075659?origin=resultslist","Accurate charging load forecasting at charging stations (CSs) is crucial for alleviating the impacts of large-scale electric vehicle (EV) integration on power grids. However, existing centralized forecasting methods rely on data sharing among CSs and EVs, which raises serious privacy and data leakage concerns. To overcome these limitations, this paper proposes a stable and efficient fully decentralized blockchain-assisted federated learning (FL) approach for CS load forecasting, ensuring data privacy and security. First, a privacy-preserving FL-based forecasting framework is developed, in which CSs collaboratively train a global model by exchanging model parameters instead of raw data. Each CS adopts a hybrid deep learning model that combines a Temporal Convolutional Network (TCN) and a Long Short-Term Memory (LSTM) network to capture both local temporal patterns and long-term dependencies in charging load data, while maintaining low communication overhead and high parallelism. Second, to eliminate the single point of failure associated with centralized servers, a blockchain-based distributed aggregation mechanism is designed, where model aggregation tasks are dynamically assigned to a subset of CSs in each training round. Moreover, a model verification algorithm is introduced to identify and discard low-quality or malicious updates, thereby mitigating poisoning attacks, and enhancing system robustness and security further. Finally, extensive experiments demonstrate that the proposed method achieves superior forecasting accuracy and robust performance under various conditions, while effectively preserving the privacy and security of CS load data. © 2026","Blockchain; Federated learning; Load forecasting; Model validation; Privacy and security","Data Sharing; Electric load forecasting; Electric power plant loads; Learning systems; Long short-term memory; Network security; Privacy-preserving techniques; Block-chain; Charging loads; Charging station; Decentralised; Forecasting methods; Large-scales; Load data; Load forecasting; Model validation; Privacy and security; Blockchain","Article","Final","","Scopus","2-s2.0-105033075659"
"Rajasekaran A.S.; Maria A.; Al-Turjman F.; Altrjman C.; Mostarda L.","Rajasekaran, Arun Sekar (57518179200); Maria, Azees (55823331700); Al-Turjman, Fadi (20336944100); Altrjman, Chadi (57207945243); Mostarda, Leonardo (57221267553)","57518179200; 55823331700; 20336944100; 57207945243; 57221267553","ABRIS: Anonymous blockchain based revocable and integrity preservation scheme for vehicle to grid network","2022","Energy Reports","8","","","9331","9343","22","10.1016/j.egyr.2022.07.064","https://www.scopus.com/pages/publications/85134886375?origin=resultslist","The upcoming development in vehicle to grid network (V2G) allows for the flow of energy from battery powered Electric Vehicle (EV) to grid as well as the exchange of information between them. However, during the information exchange, the EV's confidential information should be transferred from one charging station to another in a secure manner. Furthermore, the anonymity of the EV and charging station should be preserved. Despite the fact that many works on anonymous authentication and privacy preservation exist, there is an increase in computational cost in existing surveys. In this work, the new charging station authenticates the EV using blockchain technology without the involvement of a trusted entity, resulting in a reduction in computational time. Moreover, an efficient revoking mechanism is suggested to block the misbehaving charging station from the V2G network. In addition, security analysis section proves the resistant of our work against several possible well known attacks. Finally, to evaluate the performance of the work, the simulation is performed using CYGWIN platform and the results are proved to be noteworthy. © 2022","Authentication; Blockchain; Integrity; Revocation","Blockchain; Charging (batteries); Simulation platform; Vehicle-to-grid; Vehicles; Battery-powered electric vehicles; Block-chain; Charging station; Exchange of information; Flow of energy; Grid network; Integrity; Integrity preservations; Revocation; Vehicle to grids; Authentication","Review","Final","All Open Access; Gold Open Access; Green Open Access","Scopus","2-s2.0-85134886375"
"Shall Peelam M.; Chamola V.; Sai S.; Jalan P.","Shall Peelam, Mritunjay (57263897400); Chamola, Vinay (55427784900); Sai, Siva (57222507229); Jalan, Pranay (60025125700)","57263897400; 55427784900; 57222507229; 60025125700","Blockchain-Based Game Theoretical Framework for V2V and V2G Energy Trading in Carbon-Intelligent Internet of Vehicles","2025","IEEE Internet of Things Journal","12","19","","40034","40053","6","10.1109/JIOT.2025.3588000","https://www.scopus.com/pages/publications/105012266142?origin=resultslist","electric vehicles (EVs) are becoming more popular as people try to live more eco-friendly ways. A major challenge slowing down their widespread adoption is limited driving range and inadequate charging infrastructure, particularly in rural and highway areas where charging station deployment remains uneven. This article proposed a blockchain-based framework for vehicle-to-vehicle (V2V) and vehicle-to-grid (V2G) energy trading to address these challenges, enabling efficient decentralized energy exchanges. The framework integrates three-game theory (GT) models, contract theory, Bayesian GT, and evolutionary GT to optimize trading strategies, ensure fairness, and enhance grid stability. By utilizing a lightweight blockchain architecture on Hyperledger Fabric, the proposed system ensures secure, transparent, and efficient transactions while reducing operational costs. The performance evaluations show that the proposed framework surpasses existing methods, reaching a transaction throughput of 49.8 transactions per second (TPS) for payment settlements and 44.7 TPS for energy trade proposals, with an average latency ranging from 0.09 to 0.18 s. Resource utilization analysis shows that peer nodes experience an average CPU usage of 23.76% and memory consumption of 169.5 MB during trade proposals. These results highlight the robustness and scalability of the framework in enabling decentralized, carbon-intelligent energy trading, offering a promising solution for advancing sustainable and intelligent EV energy ecosystems.  © 2014 IEEE.","carbon neutrality; carbon-intelligent Internet of Vehicles (CI-IoV); decentralized energy systems; energy trading; Internet of Vehicles (IoV); smart mobility; vehicle-to-grid (V2G); vehicle-to-vehicle (V2V)","Blockchain; Carbon; Distributed computer systems; Ecosystems; Electronic trading; Intelligent vehicle highway systems; Internet of Energy; Internet of things; Power markets; Vehicles; Block-chain; Carbon intelligent IoV; Carbon neutralities; Decentralized energy system; Eco-friendly; Energy trading; Game-theoretical framework; Internet of vehicle; Smart mobility; V2V; Game theory","Article","Final","","Scopus","2-s2.0-105012266142"
"Sahu B.L.; Chandrakar P.","Sahu, Brijmohan Lal (58198651300); Chandrakar, Preeti (57188739692)","58198651300; 57188739692","Range anxiety mitigation through blockchain-based mobile charging delivery service in Internet of Electric Vehicles","2025","Computers and Electrical Engineering","128","","110647","","","2","10.1016/j.compeleceng.2025.110647","https://www.scopus.com/pages/publications/105014518588?origin=resultslist","Sensor-rich Electric Vehicles (EVs) in Vehicular Ad-Hoc Networks (VANETs) have transformed it into the Internet of Electric Vehicles (IoEV). Identified challenges in climate-friendly and low-carbon footprint EVs are: First, range anxiety due to the unavailability of charging stations, battery charging duration and capacity in EV users. Second, the threat of privacy leakage and the limitations of software-based security in IoEV. Third is the absence of a mechanism to ensure the delivery of the promised battery and to verify delivery. The proposed framework focused on reducing range anxiety through the delivery of swappable EV batteries at locations as Mobile Charging Delivery Service (MCDS). The software and hardware-level security is provided by the integration of blockchain and Physical Unclonable Functions (PUFs). A Proof-of-Promised Battery (PoPB) mechanism is also introduced to ensure the delivery. Experimental results and Scyther tool analysis prove the effectiveness of the proposed framework and its superiority over recent works. © 2025","Authentication; Blockchain; Internet of Electric Vehicles; On-demand charging; Physical unclonable functions; Proof-of-promised battery; Range anxiety","Charging (batteries); Charging stations; Cryptography; Electric vehicles; Hardware security; Internet of things; Network security; Secondary batteries; Vehicular ad hoc networks; Block-chain; Delivery service; Internet of electric vehicle; Low carbon; Mobile charging; On demands; On-demand charging; Proof-of-promised battery; Range anxieties; Vehicular Adhoc Networks (VANETs); Authentication; Blockchain","Article","Final","All Open Access; Hybrid Gold Open Access","Scopus","2-s2.0-105014518588"
